2	Antonette	FALSE	suscipit repellat esse quibusdam voluptatem incidunt
2	Antonette	TRUE	distinctio vitae autem nihil ut molestias quo
2	Antonette	FALSE	et itaque necessitatibus maxime molestiae qui quas velit
2	Antonette	FALSE	adipisci non ad dicta qui amet quaerat doloribus ea
2	Antonette	TRUE	voluptas quo tenetur perspiciatis explicabo natus
2	Antonette	TRUE	aliquam aut quasi
2	Antonette	TRUE	veritatis pariatur delectus
2	Antonette	FALSE	nesciunt totam sit blanditiis sit
2	Antonette	FALSE	laborum aut in quam
2	Antonette	TRUE	nemo perspiciatis repellat ut dolor libero commodi blanditiis omnis
2	Antonette	FALSE	repudiandae totam in est sint facere fuga
2	Antonette	FALSE	earum doloribus ea doloremque quis
2	Antonette	FALSE	sint sit aut vero
2	Antonette	FALSE	porro aut necessitatibus eaque distinctio
2	Antonette	TRUE	repellendus veritatis molestias dicta incidunt
2	Antonette	TRUE	excepturi deleniti adipisci voluptatem et neque optio illum ad
2	Antonette	FALSE	sunt cum tempora
2	Antonette	FALSE	totam quia non
2	Antonette	FALSE	doloremque quibusdam asperiores libero corrupti illum qui omnis
2	Antonette	TRUE	totam atque quo nesciunt
